{
  "$schema": "http://json-schema.org/draft-07/schema#",
  "title": "Plan",
  "type": "object",
  "additionalProperties": false,
  "required": ["plan_id", "task_id", "steps", "deliverables", "assumptions", "risks"],
  "properties": {
    "plan_id": {"type": "string", "minLength": 1},
    "task_id": {"type": "string", "minLength": 1},
    "steps": {
      "type": "array",
      "minItems": 1,
      "items": {
        "type": "object",
        "additionalProperties": false,
        "required": ["step_id", "intent", "tool", "inputs", "expected_output"],
        "properties": {
          "step_id": {"type": "string"},
          "intent": {"type": "string"},
          "tool": {"type": "string"},
          "inputs": {"type": "object"},
          "expected_output": {"type": "string"}
        }
      }
    },
    "deliverables": {"type": "array", "items": {"type": "string"}},
    "assumptions": {"type": "array", "items": {"type": "string"}},
    "risks": {"type": "array", "items": {"type": "string"}}
  }
}
